<?xml version="1.0" encoding="UTF-8" standalone="yes"?>
<?xml:stylesheet type="text/xsl" href="msi.xsl" ?>
<!--
      XML Dump of Windows Installer Database
      Created with msi2xml 1.1

      (C) 2001 Daniel Gehriger (gehriger@linkcad.com)
-->
<!DOCTYPE msi [
   <!ELEMENT msi   (summary,table*)>
   <!ATTLIST msi version   CDATA #REQUIRED>
   <!ATTLIST msi xmlns:dt  CDATA #IMPLIED>
   <!ELEMENT summary       (codepage?,title?,subject?,author?,keywords?,comments?,
                            template,lastauthor?,revnumber,lastprinted?,
                            createdtm?,lastsavedtm?,pagecount,wordcount,
                            charcount?,appname?,security?)>
   <!ELEMENT codepage      (#PCDATA)>
   <!ELEMENT title         (#PCDATA)>
   <!ELEMENT subject       (#PCDATA)>
   <!ELEMENT author        (#PCDATA)>
   <!ELEMENT keywords      (#PCDATA)>
   <!ELEMENT comments      (#PCDATA)>
   <!ELEMENT template      (#PCDATA)>
   <!ELEMENT lastauthor    (#PCDATA)>
   <!ELEMENT revnumber     (#PCDATA)>
   <!ELEMENT lastprinted   (#PCDATA)>
   <!ELEMENT createdtm     (#PCDATA)>
   <!ELEMENT lastsavedtm   (#PCDATA)>
   <!ELEMENT pagecount     (#PCDATA)>
   <!ELEMENT wordcount     (#PCDATA)>
   <!ELEMENT charcount     (#PCDATA)>
   <!ELEMENT appname       (#PCDATA)>
   <!ELEMENT security      (#PCDATA)>
   <!ELEMENT table         (col+,row*)>
   <!ATTLIST table
                 name      CDATA #REQUIRED>

   <!ELEMENT col           (#PCDATA)>
   <!ATTLIST col
                 key       (yes|no) #IMPLIED
                 def       CDATA #IMPLIED>
   <!ELEMENT row (td+)>
   <!ELEMENT td            (#PCDATA)>
   <!ATTLIST td
                 href      CDATA #IMPLIED
                 dt:dt     (string|bin.base64) #IMPLIED
                 md5       CDATA #IMPLIED>
]>
<msi version="1.1" xmlns:dt="urn:schemas-microsoft-com:datatypes">
	
	<summary>
		<codepage>1252</codepage>
		<title>Installation Database</title>
		<subject>Put Product Name here</subject>
		<author>Microsoft Corporation</author>
		<keywords>Installer,MSI,Database</keywords>
		<comments>Contact:  Your local administrator</comments>
		<template>;1033</template>
		<lastauthor>rich</lastauthor>
		<revnumber>{Put Package Code GUID Here}</revnumber>
		<lastprinted>05/04/1999 00:00</lastprinted>
		<createdtm>05/04/1999 00:00</createdtm>
		<lastsavedtm>12/23/2001 15:28</lastsavedtm>
		<pagecount>100</pagecount>
		<wordcount>2</wordcount>
		<charcount>0</charcount>
		<appname>Windows Installer</appname>
		<security>1</security>
	</summary>
	
	<table name="ActionText">
		<col key="yes" def="s72">Action</col>
		<col def="L0">Description</col>
		<col def="L0">Template</col>
		<row>
			<td>Advertise</td>
			<td>Advertising application</td>
			<td/>
		</row>
		<row>
			<td>AllocateRegistrySpace</td>
			<td>Allocating registry space</td>
			<td>Free space: [1]</td>
		</row>
		<row>
			<td>AppSearch</td>
			<td>Searching for installed applications</td>
			<td>Property: [1], Signature: [2]</td>
		</row>
		<row>
			<td>BindImage</td>
			<td>Binding executables</td>
			<td>File: [1]</td>
		</row>
		<row>
			<td>CCPSearch</td>
			<td>Searching for qualifying products</td>
			<td/>
		</row>
		<row>
			<td>CostFinalize</td>
			<td>Computing space requirements</td>
			<td/>
		</row>
		<row>
			<td>CostInitialize</td>
			<td>Computing space requirements</td>
			<td/>
		</row>
		<row>
			<td>CreateFolders</td>
			<td>Creating folders</td>
			<td>Folder: [1]</td>
		</row>
		<row>
			<td>CreateShortcuts</td>
			<td>Creating shortcuts</td>
			<td>Shortcut: [1]</td>
		</row>
		<row>
			<td>DeleteServices</td>
			<td>Deleting services</td>
			<td>Service: [1]</td>
		</row>
		<row>
			<td>DuplicateFiles</td>
			<td>Creating duplicate files</td>
			<td>File: [1],  Directory: [9],  Size: [6]</td>
		</row>
		<row>
			<td>FileCost</td>
			<td>Computing space requirements</td>
			<td/>
		</row>
		<row>
			<td>FindRelatedProducts</td>
			<td>Searching for related applications</td>
			<td>Found application: [1]</td>
		</row>
		<row>
			<td>GenerateScript</td>
			<td>Generating script operations for action:</td>
			<td>[1]</td>
		</row>
		<row>
			<td>InstallAdminPackage</td>
			<td>Copying network install files</td>
			<td>File: [1], Directory: [9], Size: [6]</td>
		</row>
		<row>
			<td>InstallFiles</td>
			<td>Copying new files</td>
			<td>File: [1],  Directory: [9],  Size: [6]</td>
		</row>
		<row>
			<td>InstallODBC</td>
			<td>Installing ODBC components</td>
			<td/>
		</row>
		<row>
			<td>InstallSFPCatalogFile</td>
			<td>Installing system catalog</td>
			<td>File: [1],  Dependencies: [2]</td>
		</row>
		<row>
			<td>InstallServices</td>
			<td>Installing new services</td>
			<td>Service: [2]</td>
		</row>
		<row>
			<td>InstallValidate</td>
			<td>Validating install</td>
			<td/>
		</row>
		<row>
			<td>LaunchConditions</td>
			<td>Evaluating launch conditions</td>
			<td/>
		</row>
		<row>
			<td>MigrateFeatureStates</td>
			<td>Migrating feature states from related applications</td>
			<td>Application: [1]</td>
		</row>
		<row>
			<td>MoveFiles</td>
			<td>Moving files</td>
			<td>File: [1],  Directory: [9],  Size: [6]</td>
		</row>
		<row>
			<td>MsiPublishAssemblies</td>
			<td>Publishing assembly information</td>
			<td>Application Context:[1], Assembly Name:[2]</td>
		</row>
		<row>
			<td>MsiUnpublishAssemblies</td>
			<td>Unpublishing assembly information</td>
			<td>Application Context:[1], Assembly Name:[2]</td>
		</row>
		<row>
			<td>PatchFiles</td>
			<td>Patching files</td>
			<td>File: [1],  Directory: [2],  Size: [3]</td>
		</row>
		<row>
			<td>ProcessComponents</td>
			<td>Updating component registration</td>
			<td/>
		</row>
		<row>
			<td>PublishComponents</td>
			<td>Publishing Qualified Components</td>
			<td>Component ID: [1], Qualifier: [2]</td>
		</row>
		<row>
			<td>PublishFeatures</td>
			<td>Publishing Product Features</td>
			<td>Feature: [1]</td>
		</row>
		<row>
			<td>PublishProduct</td>
			<td>Publishing product information</td>
			<td/>
		</row>
		<row>
			<td>RMCCPSearch</td>
			<td>Searching for qualifying products</td>
			<td/>
		</row>
		<row>
			<td>RegisterClassInfo</td>
			<td>Registering Class servers</td>
			<td>Class Id: [1]</td>
		</row>
		<row>
			<td>RegisterComPlus</td>
			<td>Registering COM+ Applications and Components</td>
			<td>AppId: [1]{{, AppType: [2], Users: [3], RSN: [4]}}</td>
		</row>
		<row>
			<td>RegisterExtensionInfo</td>
			<td>Registering extension servers</td>
			<td>Extension: [1]</td>
		</row>
		<row>
			<td>RegisterFonts</td>
			<td>Registering fonts</td>
			<td>Font: [1]</td>
		</row>
		<row>
			<td>RegisterMIMEInfo</td>
			<td>Registering MIME info</td>
			<td>MIME Content Type: [1], Extension: [2]</td>
		</row>
		<row>
			<td>RegisterProduct</td>
			<td>Registering product</td>
			<td>[1]</td>
		</row>
		<row>
			<td>RegisterProgIdInfo</td>
			<td>Registering program identifiers</td>
			<td>ProgId: [1]</td>
		</row>
		<row>
			<td>RegisterTypeLibraries</td>
			<td>Registering type libraries</td>
			<td>LibID: [1]</td>
		</row>
		<row>
			<td>RegisterUser</td>
			<td>Registering user</td>
			<td>[1]</td>
		</row>
		<row>
			<td>RemoveDuplicateFiles</td>
			<td>Removing duplicated files</td>
			<td>File: [1], Directory: [9]</td>
		</row>
		<row>
			<td>RemoveEnvironmentStrings</td>
			<td>Updating environment strings</td>
			<td>Name: [1], Value: [2], Action [3]</td>
		</row>
		<row>
			<td>RemoveExistingProducts</td>
			<td>Removing applications</td>
			<td>Application: [1], Command line: [2]</td>
		</row>
		<row>
			<td>RemoveFiles</td>
			<td>Removing files</td>
			<td>File: [1], Directory: [9]</td>
		</row>
		<row>
			<td>RemoveFolders</td>
			<td>Removing folders</td>
			<td>Folder: [1]</td>
		</row>
		<row>
			<td>RemoveIniValues</td>
			<td>Removing INI files entries</td>
			<td>File: [1],  Section: [2],  Key: [3], Value: [4]</td>
		</row>
		<row>
			<td>RemoveODBC</td>
			<td>Removing ODBC components</td>
			<td/>
		</row>
		<row>
			<td>RemoveRegistryValues</td>
			<td>Removing system registry values</td>
			<td>Key: [1], Name: [2]</td>
		</row>
		<row>
			<td>RemoveShortcuts</td>
			<td>Removing shortcuts</td>
			<td>Shortcut: [1]</td>
		</row>
		<row>
			<td>Rollback</td>
			<td>Rolling back action:</td>
			<td>[1]</td>
		</row>
		<row>
			<td>RollbackCleanup</td>
			<td>Removing backup files</td>
			<td>File: [1]</td>
		</row>
		<row>
			<td>SelfRegModules</td>
			<td>Registering modules</td>
			<td>File: [1], Folder: [2]</td>
		</row>
		<row>
			<td>SelfUnregModules</td>
			<td>Unregistering modules</td>
			<td>File: [1], Folder: [2]</td>
		</row>
		<row>
			<td>SetODBCFolders</td>
			<td>Initializing ODBC directories</td>
			<td/>
		</row>
		<row>
			<td>StartServices</td>
			<td>Starting services</td>
			<td>Service: [1]</td>
		</row>
		<row>
			<td>StopServices</td>
			<td>Stopping services</td>
			<td>Service: [1]</td>
		</row>
		<row>
			<td>UnmoveFiles</td>
			<td>Removing moved files</td>
			<td>File: [1], Directory: [9]</td>
		</row>
		<row>
			<td>UnpublishComponents</td>
			<td>Unpublishing Qualified Components</td>
			<td>Component ID: [1], Qualifier: [2]</td>
		</row>
		<row>
			<td>UnpublishFeatures</td>
			<td>Unpublishing Product Features</td>
			<td>Feature: [1]</td>
		</row>
		<row>
			<td>UnpublishProduct</td>
			<td>Unpublishing product information</td>
			<td/>
		</row>
		<row>
			<td>UnregisterClassInfo</td>
			<td>Unregister Class servers</td>
			<td>Class Id: [1]</td>
		</row>
		<row>
			<td>UnregisterComPlus</td>
			<td>Unregistering COM+ Applications and Components</td>
			<td>AppId: [1]{{, AppType: [2]}}</td>
		</row>
		<row>
			<td>UnregisterExtensionInfo</td>
			<td>Unregistering extension servers</td>
			<td>Extension: [1]</td>
		</row>
		<row>
			<td>UnregisterFonts</td>
			<td>Unregistering fonts</td>
			<td>Font: [1]</td>
		</row>
		<row>
			<td>UnregisterMIMEInfo</td>
			<td>Unregistering MIME info</td>
			<td>MIME Content Type: [1], Extension: [2]</td>
		</row>
		<row>
			<td>UnregisterProgIdInfo</td>
			<td>Unregistering program identifiers</td>
			<td>ProgId: [1]</td>
		</row>
		<row>
			<td>UnregisterTypeLibraries</td>
			<td>Unregistering type libraries</td>
			<td>LibID: [1]</td>
		</row>
		<row>
			<td>WriteEnvironmentStrings</td>
			<td>Updating environment strings</td>
			<td>Name: [1], Value: [2], Action [3]</td>
		</row>
		<row>
			<td>WriteIniValues</td>
			<td>Writing INI files values</td>
			<td>File: [1],  Section: [2],  Key: [3], Value: [4]</td>
		</row>
		<row>
			<td>WriteRegistryValues</td>
			<td>Writing system registry values</td>
			<td>Key: [1], Name: [2], Value: [3]</td>
		</row>
	</table>

	<table name="AdminExecuteSequence">
		<col key="yes" def="s72">Action</col>
		<col def="S255">Condition</col>
		<col def="I2">Sequence</col>
		<row>
			<td>CostFinalize</td>
			<td/>
			<td>1000</td>
		</row>
		<row>
			<td>CostInitialize</td>
			<td/>
			<td>800</td>
		</row>
		<row>
			<td>FileCost</td>
			<td/>
			<td>900</td>
		</row>
		<row>
			<td>InstallAdminPackage</td>
			<td/>
			<td>3900</td>
		</row>
		<row>
			<td>InstallFiles</td>
			<td/>
			<td>4000</td>
		</row>
		<row>
			<td>InstallFinalize</td>
			<td/>
			<td>6600</td>
		</row>
		<row>
			<td>InstallInitialize</td>
			<td/>
			<td>1500</td>
		</row>
		<row>
			<td>InstallValidate</td>
			<td/>
			<td>1400</td>
		</row>
	</table>

	<table name="AdminUISequence">
		<col key="yes" def="s72">Action</col>
		<col def="S255">Condition</col>
		<col def="I2">Sequence</col>
		<row>
			<td>AdminWelcomeDlg</td>
			<td/>
			<td>1230</td>
		</row>
		<row>
			<td>CostFinalize</td>
			<td/>
			<td>1000</td>
		</row>
		<row>
			<td>CostInitialize</td>
			<td/>
			<td>800</td>
		</row>
		<row>
			<td>ExecuteAction</td>
			<td/>
			<td>1300</td>
		</row>
		<row>
			<td>ExitDialog</td>
			<td/>
			<td>-1</td>
		</row>
		<row>
			<td>FatalError</td>
			<td/>
			<td>-3</td>
		</row>
		<row>
			<td>FileCost</td>
			<td/>
			<td>900</td>
		</row>
		<row>
			<td>PrepareDlg</td>
			<td/>
			<td>140</td>
		</row>
		<row>
			<td>ProgressDlg</td>
			<td/>
			<td>1280</td>
		</row>
		<row>
			<td>UserExit</td>
			<td/>
			<td>-2</td>
		</row>
	</table>

	<table name="AdvtExecuteSequence">
		<col key="yes" def="s72">Action</col>
		<col def="S255">Condition</col>
		<col def="I2">Sequence</col>
		<row>
			<td>CostFinalize</td>
			<td/>
			<td>1000</td>
		</row>
		<row>
			<td>CostInitialize</td>
			<td/>
			<td>800</td>
		</row>
		<row>
			<td>CreateShortcuts</td>
			<td/>
			<td>4500</td>
		</row>
		<row>
			<td>InstallFinalize</td>
			<td/>
			<td>6600</td>
		</row>
		<row>
			<td>InstallInitialize</td>
			<td/>
			<td>1500</td>
		</row>
		<row>
			<td>InstallValidate</td>
			<td/>
			<td>1400</td>
		</row>
		<row>
			<td>PublishComponents</td>
			<td/>
			<td>6200</td>
		</row>
		<row>
			<td>PublishFeatures</td>
			<td/>
			<td>6300</td>
		</row>
		<row>
			<td>PublishProduct</td>
			<td/>
			<td>6400</td>
		</row>
		<row>
			<td>RegisterClassInfo</td>
			<td/>
			<td>4600</td>
		</row>
		<row>
			<td>RegisterExtensionInfo</td>
			<td/>
			<td>4700</td>
		</row>
		<row>
			<td>RegisterMIMEInfo</td>
			<td/>
			<td>4900</td>
		</row>
		<row>
			<td>RegisterProgIdInfo</td>
			<td/>
			<td>4800</td>
		</row>
	</table>

	<table name="BBControl">
		<col key="yes" def="s50">Billboard_</col>
		<col key="yes" def="s50">BBControl</col>
		<col def="s50">Type</col>
		<col def="i2">X</col>
		<col def="i2">Y</col>
		<col def="i2">Width</col>
		<col def="i2">Height</col>
		<col def="I4">Attributes</col>
		<col def="L50">Text</col>
	</table>

	<table name="Billboard">
		<col key="yes" def="s50">Billboard</col>
		<col def="s38">Feature_</col>
		<col def="S50">Action</col>
		<col def="I2">Ordering</col>
	</table>

	<table name="Binary">
		<col key="yes" def="s72">Name</col>
		<col def="v0">Data</col>
		<row>
			<td>New</td>
			<td dt:dt="bin.base64" md5="c23cbf002d82192481b61ed7ec0890f4">
AAABAAEAEBAQAAAAAAAoAQAAFgAAACgAAAAQAAAAIAAAAAEABAAAAAAAgAAAAAAAAAAAAAAA
AAAAAAAAAAAAAAAAAACAAACAAAAAgIAAgAAAAIAAgACAgAAAwMDAAICAgAAAAP8AAP8AAAD/
/wD/AAAA/wD/AP//AAD///8AAAAAAAAAAAAAAAAAAAAAAAC7u7u7sAAAALu7u7uwAAAAu7u7
u7AAAAC7u7u7sAAAALu7u7uwAAAAu7u7u7AAAAAAAAAAAAAAAAu7sAAAAAAAAAAAAAAAAAAA
AAAAAAAAAAAAAAAAAAAAAAAAAAAAAAAAAAAAAAAAAAAAAAAAAAD//wAAgA8AAIAPAACADwAA
gA8AAIANAACACwAAgAcAAIAaAADA1wAA4asAAP99AAD/7wAA//8AAP/vAAD//wAA
			</td>
		</row>
		<row>
			<td>Up</td>
			<td dt:dt="bin.base64" md5="83730ac00391fb0f02f56fe2e4207a10">
AAABAAEAEBAQAAAAAAAoAQAAFgAAACgAAAAQAAAAIAAAAAEABAAAAAAAgAAAAAAAAAAAAAAA
AAAAAAAAAAAAAAAAAACAAACAAAAAgIAAgAAAAIAAgACAgAAAwMDAAICAgAAAAP8AAP8AAAD/
/wD/AAAA/wD/AP//AAD///8AAAAAAAAAAAAAAAAAAAAAAAC7u7u7u7uwALu7u7u7u7AAu7sA
AAC7sAC7uwu7u7uwALu7C7u7u7AAuwAAC7u7sAC7sAC7u7uwALu7C7u7u7AAu7u7u7u7sAAA
AAAAAAAAAAu7uwAAAAAAAAAAAAAAAAAAAAAAAAAAAAAAAAAAAAD//wAAgAAAAIAAAACAAAAA
gAAAAIAAAACAAAAAgAAAAIAAAACAAAAAgAAAAIABAADAfwAA4P8AAP//AAD//wAA
			</td>
		</row>
		<row>
			<td>bannrbmp</td>
			<td dt:dt="bin.base64" md5="e586859b2837472fa621d952ae7169e2">
Qk0OBQAAAAAAAHYAAAAoAAAA9AEAAD8AAAABAAQAAgAAAJgEAAAAAAAAAAAAAAAAAAAAAAAA
AAAAAAAAgAAAgAAAAICAAIAAAACAAIAAgIAAAICAgADAwMAAAAD/AAD/AAAA//8A/wAAAP8A
/wD//wAA////AP7/9v8AAP7/9v8AAP7/9v8AAP7/9v8AAP7/9v8AAP7/9v8AAP7/9v8AAP7/
9v8AAP7/uv8wwALPCv8AAP7/uv8wDAIPCv8AAP7/uv8wwALPCv8AAP7/uv8CDCwAAAQMDwr/
AAD+/7r/MMACzwr/AAD+/7r/AgwsAAAEDA8K/wAA/v+6/zDAAs8K/wAA/v+6/wIMLAAABAwP
Cv8AAP7/uv8wwALPCv8AAP7/uv8CDCwAAAQMDwr/AAD+/7r/MMACzwr/AAD+/7r/AgwsAAAE
DA8K/wAA/v+6/xLAAATHiAb/AASHcBDAAs8K/wAA/v+6/wIMDAAACAeP/4cGdwAGj/+HAAwA
AAQMDwr/AAD+/7r/DsAABP/3DMAABs//9wAMwALPCv8AAP7/uv8CDAoAAASPhw4AAAh//4+A
CAAABAwPCv8AAP7/uv8KwAAEz/cQwAAI//fH/wrAAs8K/wAA/v+6/wIMCAAC/xAAAAwI/3AA
CPcGAAAEDA8K/wAA/v+6/wjAAATP8BDAAAR/9wbAAo8IwALPCv8AAP7/uv8CDAYAAo8SAAAE
/3AGAAAED4AEAAAEDA8K/wAA/v+6/wjAAvcQwAAEyPcGwAAGyP/3AAbAAs8K/wAA/v+6/wIM
BAAABAjwEAAABH9wBAACfwT/AvgEAAAEDA8K/wAA/v+6/wbAAATPgAzAAAqP//jAxwAK/wbA
As8K/wAA/v+6/wIMBAAABA9wCgACDwb/AogM/wAIcAAMDwr/AAD+/7r/BsACzwzAAAaP98AA
EP8CcATAAs8K/wAA/v+6/wIMBAACDw7/AAj3AP/wCgAACg9wAAwPAAr/AAD+/7r/BsACzxT/
AnAKwAAEz3AEwALPCv8AAP7/uv8CDAQAAg8K/wAEcAcE/wKHDAACfwQAAAQMDwr/AAD+/7r/
BsACyAb/AvgEwAAEz3AQwAKIBsACzwr/AAD+/7r/AgwGAAT/AocGAAL/EAAABAf3BAAABAwP
Cv8AAP7/uv8IwAAEj4AGwAAEz/cQwAAEz/AGwALPCv8AAP7/uv8CDAYAAAQP8AYAAAT/gBAA
Ao8GAAAEDA8K/wAA/v+6/wrAAv8EwAAEz/8QwAAEyPcIwALPCv8AAP7/uv8CDAgAAAoP9wD/
9wAOAAAGB/9wAAYAAAQMDwr/AAD+/7r/DMACjwT/AoAMwAAGx4+AAArAAs8K/wAA/v+6/wIM
CgAACAeP/3AKAAAGB4+HAAoAAAQMDwr/AAD+/7r/DsAACMeP/4cGdwAGj/+HAA7AAs8K/wAA
/v+6/wIMEAAABHeIBv8ABIdwDgAABAwPCv8AAP7/uv8wwALPCv8AAP7/uv8CDCwAAAQMDwr/
AAD+/7r/MMACzwr/AAD+/7r/AgwsAAAEDA8K/wAA/v+6/zDAAs8K/wAA/v+6/wIMLAAABAwP
Cv8AAP7/uv8wwALPCv8AAP7/uv8CDCwAAAQMDwr/AAD+/7r/MMACzwr/AAD+/7r/MAwCDwr/
AAD+/7r/MMACzwr/AAD+//b/AAD+//b/AAD+//b/AAD+//b/AAD+//b/AAD+//b/AAAAAQ==
			</td>
		</row>
		<row>
			<td>completi</td>
			<td dt:dt="bin.base64" md5="45b0e074f96a859adae198187ab9fa11">
AAABAAIAICAQAAAAAADoAgAAJgAAACAgAAAAAAAAqAgAAA4DAAAoAAAAIAAAAEAAAAABAAQA
AAAAAIACAAAAAAAAAAAAABAAAAAAAAAAAAAAAAAAgAAAgAAAAICAAIAAAACAAIAAgIAAAMDA
wACAgIAAAAD/AAD/AAAA//8A/wAAAP8A/wD//wAA////AAAAAAAAAAAAAAAAAAAAAAAAAAAA
AACIgAAAAAAAAAAAAAAAAACId7u6AAAAAAAAAAAAAAAI9/d7uqoAAAAAAAAAAAAAh49/u6qn
cAAAAAAAAAAAAIh493uqd3AAAAAAAAAAAAiHh497p3fuAAAAAAAAAAAIeHh4AKfu7gAAAAAA
AAAACIeHgP8O7ncAAAAAAAAAAAh3fuD/CHh4AAAAAAAAAAAIfueuAIeHhwd3d3cAiIiICO56
7r/4eHgAAAB3gI+f+ACHru6/f4eAiIiId4CJmfgAiu7rt/f4cP////+AmfmYAAjuu7d/fwiI
iIiHgI//mQAAiLu3dwAAAAAAAHCIiImQAACIiIh3d3d3d3gAAAAAkAAACP////////94AIiI
iAAAAAj0RERERERPeACPn/gAAAAI9Od2ZmzMT3gAiZn4AAAACPT+d2ZmzE94AJn5mAAAAAj0
7+d2ZmxPeACP/5kAAAAI9P7+d2ZmT3gAiIiJkAAACPTv7+d2Zk94AAAAAJAAAAj0fv7+d2ZP
eACIiIgAAAAI9Hfv7+d2T3gAj5/4AAAACPR3fv7+d094AImZ+AAAAAj0RERERERPeACZ+ZgA
AAAI/////////3gAj/+ZAAAAAIiIiIiIiIiIAIiIiZAAAAAAAAAAAAAAAAAAAACQAAAAAAAA
AAAAAAAA///////wP///wA///4AH//8AA///AAP//gAB//4AAf/+AAH//gAAA/4AAAECAAAA
AwAAAAMAAAADgAAAA8AAAAHwAAH9+AABA/gAAQP4AAED+AABA/gAAQP4AAEB+AAB/fgAAQP4
AAED+AABA/gAAQP4AAED/AADAf////3///8oAAAAIAAAAEAAAAABAAgAAAAAAIAEAAAAAAAA
AAAAAAABAAAAAAAAAAAAAAAAgAAAgAAAAICAAIAAAACAAIAAgIAAAMDAwADA3MAA8MqmANTw
/wCx4v8AjtT/AGvG/wBIuP8AJar/AACq/wAAktwAAHq5AABilgAASnMAADJQANTj/wCxx/8A
jqv/AGuP/wBIc/8AJVf/AABV/wAASdwAAD25AAAxlgAAJXMAABlQANTU/wCxsf8Ajo7/AGtr
/wBISP8AJSX/AAAA/gAAANwAAAC5AAAAlgAAAHMAAABQAOPU/wDHsf8Aq47/AI9r/wBzSP8A
VyX/AFUA/wBJANwAPQC5ADEAlgAlAHMAGQBQAPDU/wDisf8A1I7/AMZr/wC4SP8AqiX/AKoA
/wCSANwAegC5AGIAlgBKAHMAMgBQAP/U/wD/sf8A/47/AP9r/wD/SP8A/yX/AP4A/gDcANwA
uQC5AJYAlgBzAHMAUABQAP/U8AD/seIA/47UAP9rxgD/SLgA/yWqAP8AqgDcAJIAuQB6AJYA
YgBzAEoAUAAyAP/U4wD/sccA/46rAP9rjwD/SHMA/yVXAP8AVQDcAEkAuQA9AJYAMQBzACUA
UAAZAP/U1AD/sbEA/46OAP9rawD/SEgA/yUlAP4AAADcAAAAuQAAAJYAAABzAAAAUAAAAP/j
1AD/x7EA/6uOAP+PawD/c0gA/1clAP9VAADcSQAAuT0AAJYxAABzJQAAUBkAAP/w1AD/4rEA
/9SOAP/GawD/uEgA/6olAP+qAADckgAAuXoAAJZiAABzSgAAUDIAAP//1AD//7EA//+OAP//
awD//0gA//8lAP7+AADc3AAAubkAAJaWAABzcwAAUFAAAPD/1ADi/7EA1P+OAMb/awC4/0gA
qv8lAKr/AACS3AAAerkAAGKWAABKcwAAMlAAAOP/1ADH/7EAq/+OAI//awBz/0gAV/8lAFX/
AABJ3AAAPbkAADGWAAAlcwAAGVAAANT/1ACx/7EAjv+OAGv/awBI/0gAJf8lAAD+AAAA3AAA
ALkAAACWAAAAcwAAAFAAANT/4wCx/8cAjv+rAGv/jwBI/3MAJf9XAAD/VQAA3EkAALk9AACW
MQAAcyUAAFAZANT/8ACx/+IAjv/UAGv/xgBI/7gAJf+qAAD/qgAA3JIAALl6AACWYgAAc0oA
AFAyANT//wCx//8Ajv//AGv//wBI//8AJf//AAD+/gAA3NwAALm5AACWlgAAc3MAAFBQAPLy
8gDm5uYA2traAM7OzgDCwsIAtra2AKqqqgCenp4AkpKSAIaGhgB6enoAbm5uAGJiYgBWVlYA
SkpKAD4+PgAyMjIAJiYmABoaGgAODg4A8Pv/AKSgoACAgIAAAAD/AAD/AAAA//8A/wAAAP8A
/wD//wAA////AAAAAAAAAAAAAAAAAAAAAAAAAAAAAAAAAAAAAAAAAAAAAAAAAAAAAAAAAAAA
7+/v8vLyAAAAAAAAAAAAAAAAAAAAAAAAAAAAAAAA7+/l5diylYny8gAAAAAAAAAAAAAAAAAA
AAAAAAAAAO/m5uXl2LKViZec8gAAAAAAAAAAAAAAAAAAAAAAAADv5+bm5uXYlYmXnJyc8gAA
AAAAAAAAAAAAAAAAAAAAAO3n5+bm5diJl5yc4+PyAAAAAAAAAAAAAAAAAAAAAADv5+fn5+bl
5Zec4+Pj4+PyAAAAAAAAAAAAAAAAAAAAAO/l5+fn5+YAAOPj4+fn5/IAAAAAAAAAAAAAAAAA
AAAA7+Xl5efnAP//AOvr6+fn8gAAAAAAAAAAAAAAAAAAAADv6enp6ekA//8A5OTr6+vyAAAA
AAAAAAAAAAAAAAAAAO/j45yclZUAAOf3/+Tn5/Ln5+fn5+fnAADr6+vr6+sA7+OclZWJ6enN
5/fm/+Tk8gAAAAAA5ufrAOv/+f//6wAA75WViemp2M3n5/fm//Lr6+vr6+vm5+sA6/kb+f/r
AADvlYmJ6djYzc3n9/fm8ubm5ubm5ubn6wD5G/8b+esAAADviemp2M3Nzefn9/Lr6+vr6+vr
6+frAOv///8b+QAAAADt7anYzc3N5/LyAAAAAAAAAAAAAOf16+vr6+sb+QAAAAAA6urq6u3t
5ubm5ubm5ubm5ubrAAD////////5AAAAAAAA6///////////////////5usAAOvr6+vr6wAA
AAAAAADr/wQEBAQEBAQEBAQEBP/m6wAA6//5///rAAAAAAAAAOv/BP6FhYmJiYl7e3sE/+br
AADr+Rv5/+sAAAAAAAAA6/8EjpOFhYmJiYl7ewT/5usAAPkb/xv56wAAAAAAAADr/wSTjpOF
hYmJiYl7BP/m6wAA6////xv5AAAAAAAAAOv/BI6TjpOFhYmJiYkE/+brAADr6+vr6xv5AAAA
AAAA6/8Ek46TjpOFhYmJiQT/5usAAP////////kAAAAAAADr/wSFk46TjpOFhYmJBP/m6wAA
6+vr6+vrAAAAAAAAAOv/BIWFk46TjpOFhYkE/+brAADr//n//+sAAAAAAAAA6/8EhYWFk46T
jv6FhQT/5usAAOv5G/n/6wAAAAAAAADr/wQEBAQEBAQEBAQEBP/m6wAA+Rv/G/nrAAAAAAAA
AOv//////////////////+brAADr////G/kAAAAAAAAAAO3t7e3t7e3t7e3t7e3t7e0AAOvr
6+vrG/kAAAAAAAAAAAAAAAAAAAAAAAAAAAAAAAAAAAAAAAAA+QAAAAAAAAAAAAAAAAAAAAAA
AAAAAAAAAAD///////A////AD///gAf//wAD//8AA//+AAH//gAB//4AAf/+AAAD/gAAAQIA
AAADAAAAAwAAAAOAAAADwAAAAfAAAQH4AAED+AABA/gAAQP4AAED+AABA/gAAQH4AAEB+AAB
A/gAAQP4AAED+AABA/gAAQP8AAMB/////f///w==
			</td>
		</row>
		<row>
			<td>custicon</td>
			<td dt:dt="bin.base64" md5="3eaebdade778394f06b29659c9c01ed7">
AAABAAIAICAQAAAAAADoAgAAJgAAACAgAAAAAAAAqAgAAA4DAAAoAAAAIAAAAEAAAAABAAQA
AAAAAIACAAAAAAAAAAAAABAAAAAAAAAAAAAAAAAAgAAAgAAAAICAAIAAAACAAIAAgIAAAMDA
wACAgIAAAAD/AAD/AAAA//8A/wAAAP8A/wD//wAA////AAAAAAAAAAAAAAAAAAAAAAAAAAAA
AACIgAAAAAAAAAAAAAAAAACId7u6AAAAAAAAAAAAAAAI9/d7uqoAAAAAAAAAAAAAh49/u6qn
cAAAAAAAAAAAAIh493uqd3AAAAAAAAAAAAiHh497p3fuAAAAAAAAAAAIeHh4AKfu7gAAAAAA
AAAACIeHgP8O7ncAAAAAAAAAAAh3fuD/CHh4AAAAAAAAAAAIfueuAIeHhwd3d3cAAAAACO56
7r/4eHgAAAB3gI//8ACHru6/f4eAiIiId4CP//AAiu7rt/f4cP////+Aj//wAAjuu7d/fwiI
iIiHgI//8AAAiLu3dwAAAAAAAHCIiIAAAACIiIh3d3d3d3gAAAAAAAAACP////////94AAAA
AAAAAAj0RERERERPeACP//AAAAAI9Od2ZmzMT3gAj//wAAAACPT+d2ZmzE94AI//8AAAAAj0
7+d2ZmxPeACP//AAAAAI9P7+d2ZmT3gAiIiAAAAACPTv7+d2Zk94AAAAAAAAAAj0fv7+d2ZP
eACIiIgAAAAI9Hfv7+d2T3gAj5/4AAAACPR3fv7+d094AImZ+AAAAAj0RERERERPeACZ+ZgA
AAAI/////////3gAj/+ZAAAAAIiIiIiIiIiIAIiIiZAAAAAAAAAAAAAAAAAAAACQAAAAAAAA
AAAAAAAA///////wP///wA///4AH//8AA///AAP//gAB//4AAf/+AAH//gAAA/4AAAECAAAA
AwAAAAMAAAADgAAAA8AAAAPwAAH/+AABA/gAAQP4AAED+AABA/gAAQP4AAED+AAB//gAAQP4
AAED+AABA/gAAQP4AAED/AADAf////3///8oAAAAIAAAAEAAAAABAAgAAAAAAIAEAAAAAAAA
AAAAAAABAAAAAAAAAAAAAAAAgAAAgAAAAICAAIAAAACAAIAAgIAAAMDAwADA3MAA8MqmANTw
/wCx4v8AjtT/AGvG/wBIuP8AJar/AACq/wAAktwAAHq5AABilgAASnMAADJQANTj/wCxx/8A
jqv/AGuP/wBIc/8AJVf/AABV/wAASdwAAD25AAAxlgAAJXMAABlQANTU/wCxsf8Ajo7/AGtr
/wBISP8AJSX/AAAA/gAAANwAAAC5AAAAlgAAAHMAAABQAOPU/wDHsf8Aq47/AI9r/wBzSP8A
VyX/AFUA/wBJANwAPQC5ADEAlgAlAHMAGQBQAPDU/wDisf8A1I7/AMZr/wC4SP8AqiX/AKoA
/wCSANwAegC5AGIAlgBKAHMAMgBQAP/U/wD/sf8A/47/AP9r/wD/SP8A/yX/AP4A/gDcANwA
uQC5AJYAlgBzAHMAUABQAP/U8AD/seIA/47UAP9rxgD/SLgA/yWqAP8AqgDcAJIAuQB6AJYA
YgBzAEoAUAAyAP/U4wD/sccA/46rAP9rjwD/SHMA/yVXAP8AVQDcAEkAuQA9AJYAMQBzACUA
UAAZAP/U1AD/sbEA/46OAP9rawD/SEgA/yUlAP4AAADcAAAAuQAAAJYAAABzAAAAUAAAAP/j
1AD/x7EA/6uOAP+PawD/c0gA/1clAP9VAADcSQAAuT0AAJYxAABzJQAAUBkAAP/w1AD/4rEA
/9SOAP/GawD/uEgA/6olAP+qAADckgAAuXoAAJZiAABzSgAAUDIAAP//1AD//7EA//+OAP//
awD//0gA//8lAP7+AADc3AAAubkAAJaWAABzcwAAUFAAAPD/1ADi/7EA1P+OAMb/awC4/0gA
qv8lAKr/AACS3AAAerkAAGKWAABKcwAAMlAAAOP/1ADH/7EAq/+OAI//awBz/0gAV/8lAFX/
AABJ3AAAPbkAADGWAAAlcwAAGVAAANT/1ACx/7EAjv+OAGv/awBI/0gAJf8lAAD+AAAA3AAA
ALkAAACWAAAAcwAAAFAAANT/4wCx/8cAjv+rAGv/jwBI/3MAJf9XAAD/VQAA3EkAALk9AACW
MQAAcyUAAFAZANT/8ACx/+IAjv/UAGv/xgBI/7gAJf+qAAD/qgAA3JIAALl6AACWYgAAc0oA
AFAyANT//wCx//8Ajv//AGv//wBI//8AJf//AAD+/gAA3NwAALm5AACWlgAAc3MAAFBQAPLy
8gDm5uYA2traAM7OzgDCwsIAtra2AKqqqgCenp4AkpKSAIaGhgB6enoAbm5uAGJiYgBWVlYA
SkpKAD4+PgAyMjIAJiYmABoaGgAODg4A8Pv/AKSgoACAgIAAAAD/AAD/AAAA//8A/wAAAP8A
/wD//wAA////AAAAAAAAAAAAAAAAAAAAAAAAAAAAAAAAAAAAAAAAAAAAAAAAAAAAAAAAAAAA
7+/v8vLyAAAAAAAAAAAAAAAAAAAAAAAAAAAAAAAA7+/l5diylYny8gAAAAAAAAAAAAAAAAAA
AAAAAAAAAO/m5uXl2LKViZec8gAAAAAAAAAAAAAAAAAAAAAAAADv5+bm5uXYlYmXnJyc8gAA
AAAAAAAAAAAAAAAAAAAAAO3n5+bm5diJl5yc4+PyAAAAAAAAAAAAAAAAAAAAAADv5+fn5+bl
5Zec4+Pj4+PyAAAAAAAAAAAAAAAAAAAAAO/l5+fn5+YAAOPj4+fn5/IAAAAAAAAAAAAAAAAA
AAAA7+Xl5efnAP//AOvr6+fn8gAAAAAAAAAAAAAAAAAAAADv6enp6ekA//8A5OTr6+vyAAAA
AAAAAAAAAAAAAAAAAO/j45yclZUAAOf3/+Tn5/Ln5+fn5+fnAADy8vLy8vIA7+OclZWJ6enN
5/fm/+Tk8gAAAAAA5ufrAOn/////8gAA75WViemp2M3n5/fm//Lr6+vr6+vm5+sA6f/////y
AADvlYmJ6djYzc3n9/fm8ubm5ubm5ubn6wDp//////IAAADviemp2M3Nzefn9/Lr6+vr6+vr
6+frAOn/////8gAAAADt7anYzc3N5/LyAAAAAAAAAAAAAOf16enp6enyAAAAAAAA6urq6u3t
5ubm5ubm5ubm5ubrAAAAAAAAAAAAAAAAAAAA6///////////////////5usAAPLy8vLy8gAA
AAAAAADr/wQEBAQEBAQEBAQEBP/m6wAA6f/////yAAAAAAAAAOv/BP6FhYmJiYl7e3sE/+br
AADp//////IAAAAAAAAA6/8EjpOFhYmJiYl7ewT/5usAAOn/////8gAAAAAAAADr/wSTjpOF
hYmJiYl7BP/m6wAA6f/////yAAAAAAAAAOv/BI6TjpOFhYmJiYkE/+brAADp6enp6fIAAAAA
AAAA6/8Ek46TjpOFhYmJiQT/5usAAAAAAAAAAAAAAAAAAADr/wSFk46TjpOFhYmJBP/m6wAA
6enp6enpAAAAAAAAAOv/BIWFk46TjpOFhYkE/+brAADp//n//+kAAAAAAAAA6/8EhYWFk46T
jv6FhQT/5usAAOn5G/n/6QAAAAAAAADr/wQEBAQEBAQEBAQEBP/m6wAAGxv/G/npAAAAAAAA
AOv//////////////////+brAADp////G/kAAAAAAAAAAO3t7e3t7e3t7e3t7e3t7e0AAOnp
6enpG/kAAAAAAAAAAAAAAAAAAAAAAAAAAAAAAAAAAAAAAAAA+QAAAAAAAAAAAAAAAAAAAAAA
AAAAAAAAAAD///////A////AD///gAf//wAD//8AA//+AAH//gAB//4AAf/+AAAD/gAAAQIA
AAADAAAAAwAAAAOAAAADwAAAA/AAAf/4AAED+AABA/gAAQP4AAED+AABA/gAAQP4AAH/+AAB
A/gAAQP4AAED+AABA/gAAQP8AAMB/////f///w==
			</td>
		</row>
		<row>
			<td>dlgbmp</td>
			<td dt:dt="bin.base64" md5="338b05346c9effd87044af6295067856">
Qk00FQAAAAAAAHYAAAAoAAAA9wEAADoBAAABAAQAAgAAAL4UAAAAAAAAAAAAAAAAAAAAAAAA
AAAAAAAAgAAAgAAAAICAAIAAAACAAIAAgIAAAMDAwACAgIAAAAD/AAD/AAAA//8A/wAAAP8A
/wD//wAA////AE5EVkD+/1T/AfAAAFREUAT+/1T/AfAAAFZETkD+/1T/AfAAAFxESAT+/1T/
AfAAAF5ERkD+/1T/AfAAAGJEQgT+/1T/AfAAAGZEPkD+/1T/AfAAAGpEOgT+/1T/AfAAAGxE
OED+/1T/AfAAAHBENAT+/1T/AfAAAHJEMkD+/1T/AfAAAHZELgT+/1T/AfAAABJAZkQsQP7/
VP8B8AAAHgReRCgE/v9U/wHwAAAmQFhEJkD+/1T/AfAAAC4EVEQiBP7/VP8B8AAANEBORCJA
/v9U/wHwAAA6BExEHgT+/1T/AfAAAEBASEQcQP7/VP8B8AAARgRGRBgE/v9U/wHwAABKQEJE
GED+/1T/AfAAAE4EQkQUBP7/VP8B8AAAUkBARBJA/v9U/wHwAABWBD5EEAT+/1T/AfAAAFpA
PEQOQP7/VP8B8AAAXgQ6RAwE/v9U/wHwAABgQDpECkD+/1T/AfAAAGQEOkQGBP7/VP8B8AAA
ZkA4RAZA/v9U/wHwAABqBDhEAgT+/1T/AfAAAGhAOkQCQP7/VP8B8AAAaAQ8RP7/VP8B8AAA
ZkA+RP7/VP8B8AAAaAQ8RP7/VP8B8AAAZkA+RP7/VP8B8AAAZgQ+RP7/VP8B8AAAZEBARP7/
VP8B8AAAZARARP7/VP8B8AAAZEBARP7/VP8B8AAAZARARP7/VP8B8AAAYkBCRP7/VP8B8AAA
YgRCRP7/VP8B8AAAYEBERP7/VP8B8AAAYARERP7/VP8B8AAAYEBERP7/VP8B8AAAYARERP7/
VP8B8AAAXkBGRP7/VP8B8AAAXgRGRP7/VP8B8AAAXEA6RAJADET+/1T/AfAAAFwEOkQGBAhE
/v9U/wHwAABcQDhECEAIRP7/VP8B8AAAXAQ4RAoEBkT+/1T/AfAAAFpAOEQOQARE/v9U/wHw
AABaBDhEEAQCRP7/VP8B8AAAWEA4RBRA/v9U/wHwAABaBDZEFAT+/1T/AfAAAFhANkQWQP7/
VP8B8AAAWAQ2RBYE/v9U/wHwAABWQDZEGED+/1T/AfAAAFYENkQYBP7/VP8B8AAAVEA2RBpA
/v9U/wHwAABWBDREGgT+/1T/AfAAAFRANEQcQP7/VP8B8AAAVAQ0RBwE/v9U/wHwAABSQDRE
HkD+/1T/AfAAAFIENEQeBP7/VP8B8AAAUkAyRCBA/v9U/wHwAABSBDJEIAT+/1T/AfAAAFBA
MkQiQP7/VP8B8AAAUAQyRCIE/v9U/wHwAABOQDJEJED+/1T/AfAAAE4EMkQkBP7/VP8B8AAA
TkAwRCZA/v9U/wHwAABOBDBEJgT+/1T/AfAAAExAMEQoQP7/VP8B8AAATAQwRCgE/v9U/wHw
AABKQDBEKkD+/1T/AfAAAEwELkQqBP7/VP8B8AAASkAuRCxA/v9U/wHwAABKBC5ELAT+/1T/
AfAAAEhALkQuQP7/VP8B8AAASAQuRC4E/v9U/wHwAABGQC5EMED+/1T/AfAAAEgELEQwBP7/
VP8B8AAARkAsRDJA/v9U/wHwAABGBCxEMgT+/1T/AfAAAERALEQ0QP7/VP8B8AAARAQsRDQE
/v9U/wHwAABEQCpENkD+/1T/AfAAAEQEKkQ2BP7/VP8B8AAAQkAqRDhA/v9U/wHwAABCBCpE
OAT+/1T/AfAAAEBAKkQ6QP7/VP8B8AAAQAQqRDoE/v9U/wHwAABAQChEPED+/1T/AfAAAEAE
KEQ8BP7/VP8B8AAAPkAoRD5A/v9U/wHwAAA+BChEPgT+/1T/AfAAADxAKERAQP7/VP8B8AAA
PgQmREAE/v9U/wHwAAA8QCZEQkD+/1T/AfAAADwEJkRCBP7/VP8B8AAAOkAmRERA/v9U/wHw
AAA6BCZERAT+/1T/AfAAADhAJkRGQP7/VP8B8AAAOgQkREYE/v9U/wHwAAA4QCRESED+/1T/
AfAAADgEJERIBP7/VP8B8AAANkAkREpA/v9U/wHwAAA2BCRESgT+/1T/AfAAADZAIkRMQP7/
VP8B8AAANgQiREwE/v9U/wHwAAA0QCJETkD+/1T/AfAAADQEIkROBP7/VP8B8AAAMkAiRFBA
/v9U/wHwAAAyBCJEUAT+/1T/AfAAADJAIERSQP7/VP8B8AAAMgQgRFIE/v9U/wHwAAAwQCBE
VED+/1T/AfAAADAEIERUBP7/VP8B8AAALkAgRFZA/v9U/wHwAAAuBCBEVgT+/1T/AfAAAC5A
HkRYQP7/VP8B8AAALgQeRFgE/v9U/wHwAAAsQB5EWkD+/1T/AfAAACwEHkRaBP7/VP8B8AAA
KkAeRFxA/v9U/wHwAAAsBBxEXAT+/1T/AfAAACpAHEReQP7/VP8B8AAAKgQcRF4E/v9U/wHw
AAAoQBxEYED+/1T/AfAAACgEHERgBP7/VP8B8AAAJkAcRGJA/v9U/wHwAAAoBBpEYgT+/1T/
AfAAACZAGkRkQP7/VP8B8AAAJgQaRGQE/v9U/wHwAAAkQBpEZkD+/1T/AfAAACQEGkRmBP7/
VP8B8AAAJEAYRGhA/v9U/wHwAAAkBBhEaAT+/1T/AfAAACJAGERqQP7/VP8B8AAAIgQYRGoE
/v9U/wHwAAAgQBhEbED+/1T/AfAAACAEGERsBP7/VP8B8AAAIEAWRG5A/v9U/wHwAAAgBBZE
bgT+/1T/AfAAAB5AFkRwQP7/VP8B8AAAHgQWRG4EAkT+/1T/AfAAABxAFkRuQARE/v9U/wHw
AAAeBBREbAQGRP7/VP8B8AAAHEAURGpACkT+/1T/AfAAABwEFERoBAxE/v9U/wHwAAAaQBRE
ZkAQRP7/VP8B8AAAGgQURGQEEkT+/1T/AfAAABhAFERiQBZE/v9U/wHwAAACRBgEEkRgBBhE
/v9U/wHwAAAKRA5AEkRgQBpE/v9U/wHwAAAQRAgEEkReBBxE/v9U/wHwAAASRARAEkRcQCBE
/v9U/wHwAAAoRFoEIkT+/1T/AfAAACZEWEAmRP7/VP8B8AAAJkRWBChE/v9U/wHwAAAkRFRA
LET+/1T/AfAAACREUgQuRP7/VP8B8AAAIkRSQDBE/v9U/wHwAAAkRE4EMkT+/1T/AfAAACZE
SEA2RP7/VP8B8AAAKEREBDhE/v9U/wHwAAAoREBAPET+/1T/AfAAACxEOgQ+RP7/VP8B8AAA
LEQ2QEJE/v9U/wHwAAAuRDIERET+/1T/AfAAAC5EMEBGRP7/VP8B8AAAMEQsBEhE/v9U/wHw
AAAwRChATET+/1T/AfAAADJEJARORP7/VP8B8AAAMkQgQFJE/v9U/wHwAAA0RBwEVET+/1T/
AfAAADREGEBYRP7/VP8B8AAANkQWBFhE/v9U/wHwAAA2RBJAXET+/1T/AfAAADhEDgReRP7/
VP8B8AAAOEQKQGJE/v9U/wHwAAA6RAYEZET+/1T/AfAAADpEAkBoRP7/VP8B8AAApET+/1T/
AfAAAKRE/v9U/wHwAACkRP7/VP8B8AAAAkCiRP7/VP8B8AAABgSeRP7/VP8B8AAACECcRP7/
VP8B8AAACgSaRP7/VP8B8AAACkCaRP7/VP8B8AAADgSWRP7/VP8B8AAADkCWRP7/VP8B8AAA
EASURP7/VP8B8AAAEECURP7/VP8B8AAAEgSSRP7/VP8B8AAAEECURP7/VP8B8AAAEgSSRP7/
VP8B8AAAEkCSRP7/VP8B8AAAFASQRP7/VP8B8AAAEkCSRP7/VP8B8AAAFASQRP7/VP8B8AAA
FECQRP7/VP8B8AAAFASQRP7/VP8B8AAAFECQRP7/VP8B8AAAFASQRP7/VP8B8AAAEkCSRP7/
VP8B8AAAFAQuRGIE/v9U/wHwAAASQC5EZED+/1T/AfAAABIELkRkBP7/VP8B8AAAEkAuRGRA
/v9U/wHwAAASBC5EZAT+/1T/AfAAABBAMERkQP7/VP8B8AAAEAQwRGQE/v9U/wHwAAAOQDBE
ZkD+/1T/AfAAAA4EMkRkBP7/VP8B8AAADEAyRGZA/v9U/wHwAAAMBDJEZgT+/1T/AfAAAApA
NERmQP7/VP8B8AAACAQ2RGYE/v9U/wHwAAAGQDZEaED+/1T/AfAAAAQEOERoBP7/VP8B8AAA
PERoQP7/VP8B8AAAPERoBP7/VP8B8AAAOkRqQP7/VP8B8AAAOkRqBP7/VP8B8AAAOERsQP7/
VP8B8AAAOkRqBP7/VP8B8AAAOERsQP7/VP8B8AAAOERsBP7/VP8B8AAANkRuQP7/VP8B8AAA
NkRuBP7/VP8B8AAANERwQP7/VP8B8AAANERwBP7/VP8B8AAAMkQkQDz/AvAQQP7/VP8B8AAA
MkQkBDz/AvQQBP7/VP8B8AAAMEQmQDz/AvAQQP7/VP8B8AAAMEQmBDz/AvQQBP7/VP8B8AAA
LkQoQAT/NEAABk//8AAQQP7/VP8B8AAALkQoBAT/NAAABg//9AAQBP7/VP8B8AAAKkQsQAT/
NEAABk//8AAQQP7/VP8B8AAAKkQsBAT/NAAABg//9AAQBP7/VP8B8AAAKEQuQAT/NEAABk//